ID,Handle,Command,Title,Author,Body HTML,Blog: Title,Blog: Handle,Tags,Published,Image: Src,Image: Alt Text,Summary,SEO Title,SEO Description
,une-france-qui-se-savoure-region-par-region,MERGE,"Une France qui se savoure, région par région",Maison Bonjour,"<p>Des Alpilles au Pays basque, chaque édition de la box commence par un territoire. Ce n'est pas un hasard : la France ne se raconte bien qu'au pluriel, par ses régions, par les paysages, les accents, les odeurs qu'elles portent.</p><p>Dans le Magazine, nous suivons ce fil. On part en Provence pour la lavande de juin, en Bretagne pour le sel d'été, en Bourgogne quand les coteaux changent de couleur. À chaque numéro, une région donne le ton — sa lumière, son rythme, sa table.</p><p>Ce que l'on aime, c'est le détour. Une petite route, un marché de village, une maison qui ouvre rarement ses portes. C'est là que la France se laisse approcher — et c'est là que le Magazine prend ses notes.</p>",Magazine,magazine,"Régions, regions, Provence, Bretagne, France",TRUE,,Régions françaises — un territoire par numéro,"Des Alpilles au Pays basque, chaque édition commence par un territoire. Le Magazine en garde la trace.","Régions françaises — Maison Bonjour Magazine","Découvrez les régions de France à travers le Magazine Maison Bonjour : Provence, Bretagne, Pays basque, et chaque territoire qui inspire nos box."
,maisons-et-artisans-les-mains-qui-font-la-france,MERGE,"Maisons & artisans : les mains qui font la France",Maison Bonjour,"<p>Un nom, un atelier, un savoir-faire. Derrière chaque objet de la box, il y a une histoire de mains — une famille, une tradition, parfois plusieurs siècles d'un même geste répété.</p><p>Dans cette rubrique, nous remontons jusqu'à eux. La cigale de Louis Sicard, fabriquée à la main depuis 1895. Le linge basque tissé sur métier ancien. Le savon de Marseille cuit en chaudron, comme avant. Ce ne sont pas des produits, ce sont des entêtements.</p><p>Rencontrer un artisan, c'est comprendre pourquoi un objet vaut son prix — et pourquoi il survit à toutes les modes. C'est aussi, parfois, voir disparaître un atelier que personne ne reprendra. Raison de plus pour en garder la trace.</p>",Magazine,magazine,"Artisans, artisans, Savoir-faire, Ateliers",TRUE,,Maisons & artisans — les mains qui fabriquent,"Un nom, un atelier, un savoir-faire. On remonte jusqu'à la main qui fabrique.","Maisons & artisans français — Maison Bonjour","Rencontrez les artisans français qui fabriquent les objets de nos box : ateliers, savoir-faire, traditions transmises de génération en génération."
,arts-de-la-table-la-france-se-recoit,MERGE,"Arts de la table : la France se reçoit",Maison Bonjour,"<p>La France se reçoit d'abord à table. Une nappe en lin un peu froissée, des assiettes en grès qui sortent du four d'un atelier de Vallauris, un verre soufflé dont aucun n'a la même épaisseur. Avant même le repas, le décor parle.</p><p>Dans cette rubrique, on parle céramique, linge, épicerie fine, couverts. On entre dans les maisons qui fournissent les chefs et celles que personne ne connaît encore. On apprend à dresser, à choisir, à transmettre — parce qu'une belle table, c'est une attention.</p><p>Et puis on parle aussi de ce que l'on mange. Du miel d'un apiculteur des Cévennes, du beurre de baratte d'un fermier normand, du sel qui change tout. La France à table, c'est un art lent, qui prend son temps.</p>",Magazine,magazine,"Table, table, Céramique, Linge",TRUE,,Arts de la table — recevoir à la française,"Céramique, linge, épicerie fine : la France se reçoit d'abord à table.","Arts de la table français — Maison Bonjour","Céramique de Vallauris, linge basque, épicerie fine : l'art de recevoir à la française décrypté dans le Magazine Maison Bonjour."
,beaute-et-parfums-rituels-qui-prennent-leur-temps,MERGE,"Beauté & parfums : des rituels qui prennent leur temps",Maison Bonjour,"<p>Avant d'être un parfum, la lavande est un paysage. Avant d'être un savon, la fleur d'oranger est un printemps de Grasse. Dans cette rubrique, on remonte aux sources — paysages, matières, gestes — de ce que l'on met sur la peau.</p><p>On parle rituels simples : une eau florale au matin, un baume en hiver, un parfum que l'on garde pour les grandes occasions. On parle aussi de matières nobles, de petites maisons qui distillent encore en alambic, et de cette idée française que la beauté n'a pas besoin d'être bruyante pour être visible.</p><p>Chaque saison apporte ses parfums. Le néroli au printemps, l'iris quand il fait froid, la verveine en plein été. Le Magazine suit ce calendrier — un rituel à la fois.</p>",Magazine,magazine,"Beauté, beaute, Parfums, Rituels",TRUE,,Beauté & parfums — rituels de saison,"Des rituels simples, des matières nobles, des parfums de saison.","Beauté & parfums français — Maison Bonjour","Lavande, néroli, fleur d'oranger : la beauté française racontée par ses paysages, ses matières et ses rituels de saison."
,objets-choisis-ce-que-l-on-garde,MERGE,"Objets choisis : ce que l'on garde, ce qui dure",Maison Bonjour,"<p>Il y a des objets que l'on achète et que l'on oublie. Il y en a d'autres que l'on garde — qui restent sur la table, dans l'entrée, près du lit, et qui finissent par appartenir à la maison plus qu'à nous.</p><p>Cette rubrique parle de ceux-là. L'objet qui dure plus qu'une mode. Le cendrier en verre soufflé qui sert de vide-poches. Le panier d'osier qu'on retrouve année après année. La cigale en céramique posée près d'une fenêtre, et qui semble toujours avoir été là.</p><p>Choisir un objet, c'est faire un pari sur le temps. On préfère un seul beau panier à dix sacs en tissu, une carafe ancienne à un verre en plastique. C'est moins, mais c'est mieux — et c'est l'idée que défend chaque numéro du Magazine.</p>",Magazine,magazine,"Objets, objets, Transmission, Durable",TRUE,,Objets choisis — ce qui dure,"Ce qu'on garde, ce qu'on transmet, ce qui dure plus qu'une mode.","Objets choisis — Maison Bonjour Magazine","La sélection d'objets qui durent : ceux que l'on garde, que l'on transmet, que l'on retrouve année après année dans la maison."
,carnets-de-voyage-notes-prises-en-chemin,MERGE,"Carnets de voyage : notes prises en chemin",Maison Bonjour,"<p>Il y a des choses que l'on apprend en voiture, entre deux villages. D'autres sur un marché de campagne, à 7h du matin, quand les producteurs déballent encore. Ce sont ces notes-là qu'on retrouve dans cette rubrique.</p><p>Pas de circuit, pas d'adresses Instagram. Plutôt des arrêts imprévus, des conversations longues avec un boulanger, une route d'oliveraies prise à contresens. On y va parce que ça nous fait envie — et on raconte ce qu'on a vu.</p><p>Pourquoi les marchés français racontent mieux que les vitrines ? Parce qu'on y croise les gens qui font. Parce que le rythme y est plus lent. Parce qu'on y apprend, en une heure, plus de choses sur une région que dans un guide entier. Le Magazine en garde les meilleurs morceaux.</p>",Magazine,magazine,"Carnets, carnets, Marchés, Voyage",TRUE,,Carnets de voyage — notes en chemin,"Des notes prises en chemin, entre un marché et une route de campagne.","Carnets de voyage en France — Maison Bonjour","Notes de voyage à travers la France : marchés de campagne, routes secondaires, rencontres avec les producteurs et artisans qui font le territoire."
